Invoice,StockCode,Description,Quantity,InvoiceDate,Price,Customer ID,Country,invalid_flag
,84509E,Carousel Placemats,2,2010-01-11 09:37:00,7.78,,UNITED KINGDOM,1
,84510E,Set Of 4 Green Carousel Coasters,2,2010-01-11 09:37:00,2.57,,UNITED KINGDOM,1
,85205B,Pink Felt Easter Rabbit Garland,1,2010-01-11 09:37:00,5.17,,UNITED KINGDOM,1
,37491B,Blue/Yellow Ceramic Candle Holder,2,2010-01-11 09:38:00,3.43,,UNITED KINGDOM,1
,47599B,Blue Party Bags,12,2010-01-11 09:53:00,2.1,15738.0,UNITED KINGDOM,0
C494024,M,Manual,-1,2010-01-11 10:09:00,17.6,12959.0,UNITED KINGDOM,0
C494030,37462E,"Pet Mug, Goldfish",-6,2010-01-11 10:25:00,0.42,,UNITED KINGDOM,1
C494033,84078A,Set/4 White Retro Storage Cubes,-4,2010-01-11 10:56:00,34.95,14527.0,UNITED KINGDOM,0
C494041,,Red Toadstool Led Night Light,-12,2010-01-11 11:57:00,1.65,12533.0,GERMANY,0
C494043,,Jigsaw Rabbit And Birdhouse,-24,2010-01-11 11:59:00,1.65,12709.0,GERMANY,0
C494044,,Large English Arboretum,-3,2010-01-11 12:00:00,16.95,16103.0,UNITED KINGDOM,0
,85188B,Pink Metal Swinging Bunny,24,2010-01-11 12:29:00,0.85,17529.0,UNITED KINGDOM,0
,72606A,Brown Antique Cube Candle,96,2010-01-11 13:24:00,0.42,18252.0,UNITED KINGDOM,0
,47583A,Set Of 3 Wicker Basket Rose,1,2010-01-11 13:51:00,24.95,17978.0,UNITED KINGDOM,0
,72740B,Large White Chocolate Candle,1,2010-01-11 14:39:00,5.06,,UNITED KINGDOM,1
,81952B,Round Blue Clock W/Sucker,1,2010-01-11 14:39:00,1.66,,UNITED KINGDOM,1
C494151,,Spotty Pink Duck Doorstop,-1,2010-01-11 15:03:00,4.25,13178.0,UNITED KINGDOM,0
,90039B,Fire Polished Glass Bracelet Montan,1,2010-01-12 09:48:00,3.81,,UNITED KINGDOM,1
C494205,,String Of 20 Rose Lights,-4,2010-01-12 11:06:00,10.95,16732.0,UNITED KINGDOM,0
C494215,POST,Postage,-4,2010-01-12 11:56:00,18.0,12623.0,GERMANY,0
C494238,84782C,Green 3 Tier Glass Plate Stand,-1,2010-01-12 15:30:00,12.75,14081.0,UNITED KINGDOM,0
C494238,84782A,Pink 3 Tier Glass Plate Stand,-1,2010-01-12 15:30:00,12.75,14081.0,UNITED KINGDOM,0
C494242,,Retro Spot Traditional Teapot,-1,2010-01-12 15:51:00,7.95,14606.0,UNITED KINGDOM,0
,84925F,Psychedelic Wall Thermometer,200,2010-01-12 15:57:00,1.7,18102.0,UNITED KINGDOM,0
C494247,,Dairy Maid Traditional Teapot,-2,2010-01-12 16:35:00,6.95,15100.0,UNITED KINGDOM,0
C494270,,Red Heart Shape Love Bucket,-6,2010-01-13 09:23:00,2.55,13410.0,UNITED KINGDOM,0
C494271,,Large Cake Stand  Hanging Strawbery,-1,2010-01-13 09:42:00,9.95,12417.0,BELGIUM,0
C494331,,Pink Heart Shape Egg Frying Pan,-2,2010-01-13 12:04:00,1.65,13457.0,UNITED KINGDOM,0
C494332,,Vintage Union Jack Pennant,-6,2010-01-13 12:08:00,1.95,13696.0,UNITED KINGDOM,0
C494333,84782A,Pink 3 Tier Glass Plate Stand,-1,2010-01-13 12:10:00,12.75,14151.0,UNITED KINGDOM,0
C494334,,Small Glass Heart Trinket Pot,-2,2010-01-13 12:16:00,2.1,14769.0,UNITED KINGDOM,0
C494334,85232B,Set/3 Russian Doll Stacking Tins,-2,2010-01-13 12:16:00,4.95,14769.0,UNITED KINGDOM,0
,90013D,Purple Vintage Earrings,4,2010-01-13 13:55:00,3.75,15755.0,UNITED KINGDOM,0
C494347,M,Manual,-1,2010-01-13 14:20:00,751.11,12510.0,SPAIN,0
C494353,M,Manual,-1,2010-01-13 14:50:00,323.88,12510.0,SPAIN,0
C494352,M,Manual,-1,2010-01-13 14:50:00,546.95,14156.0,EIRE,0
C494355,POST,Postage,-1,2010-01-13 15:04:00,174.75,12510.0,SPAIN,0
C494356,M,Manual,-1,2010-01-13 15:06:00,780.52,14911.0,EIRE,0
C494358,35004S,Set Of 3 Silver Flying Ducks,-3,2010-01-13 15:07:00,6.35,13078.0,UNITED KINGDOM,0
C494358,,Black Diner Wall Clock,-1,2010-01-13 15:07:00,8.5,13078.0,UNITED KINGDOM,0
C494360,POST,Postage,-1,2010-01-13 15:32:00,161.25,12510.0,SPAIN,0
C494361,,Victorian Sewing Box Large,-1,2010-01-13 15:48:00,10.95,12709.0,GERMANY,0
C494363,,Retro Spot Traditional Teapot,-1,2010-01-13 16:00:00,7.95,13319.0,UNITED KINGDOM,0
C494365,,Retro Spots Butter Dish,-1,2010-01-13 16:06:00,4.95,16057.0,UNITED KINGDOM,0
C494366,,Set/3 Red Gingham Rose Storage Box,-1,2010-01-13 16:07:00,3.75,13854.0,UNITED KINGDOM,0
C494367,,Large Cake Stand Hanging Hearts,-1,2010-01-13 16:09:00,9.95,15827.0,UNITED KINGDOM,0
C494368,POST,Postage,-1,2010-01-13 16:11:00,4.41,15152.0,UNITED KINGDOM,0
C494369,,Scottie Dog Hot Water Bottle,-1,2010-01-13 16:12:00,4.25,13078.0,UNITED KINGDOM,0
C494370,,Set/3 Red Gingham Rose Storage Box,-2,2010-01-13 16:24:00,3.75,13854.0,UNITED KINGDOM,0
C494371,,Snowstorm Photo Frame Fridge Magnet,-3,2010-01-13 16:25:00,0.85,12681.0,FRANCE,0
C494371,84597B,Retro Brown Ball Ashtray,-3,2010-01-13 16:25:00,1.25,12681.0,FRANCE,0
C494371,84597C,Retro Pink Ball Ashtray,-4,2010-01-13 16:25:00,1.25,12681.0,FRANCE,0
C494372,,Wooden Box Advent Calendar,-1,2010-01-13 16:27:00,8.95,15719.0,UNITED KINGDOM,0
,90001B,Antique Mid Blue Flower Earrings,1,2010-01-13 17:44:00,4.24,,UNITED KINGDOM,1
,90064A,White Vintage Crystal Earrings,1,2010-01-13 17:44:00,4.24,,UNITED KINGDOM,1
,90160A,Purple Boudicca Large Bracelet,1,2010-01-13 17:44:00,7.22,,UNITED KINGDOM,1
,15058B,Pink White Spots Garden Parasol,1,2010-01-13 17:51:00,25.49,,UNITED KINGDOM,1
,35637C,Pink String Curtain With Pole,2,2010-01-14 08:30:00,5.95,16304.0,UNITED KINGDOM,0
,17014D,Origami Rose Incense Cones,1,2010-01-14 09:41:00,3.36,,UNITED KINGDOM,1
C494430,,Strawberry Ceramic Trinket Box,-4,2010-01-14 11:09:00,1.25,13004.0,UNITED KINGDOM,0
C494431,,Retro Spot Traditional Teapot,-1,2010-01-14 11:27:00,7.95,14590.0,UNITED KINGDOM,0
C494438,BANK CHARGES,Bank Charges,-1,2010-01-14 12:15:00,767.99,,UNITED KINGDOM,1
,37489D,Pink/Green Flower Design Big Mug,1,2010-01-14 13:03:00,1.95,15898.0,UNITED KINGDOM,0
C494444,,Assorted Colour Jumbo Pen,-1,2010-01-14 13:09:00,0.84,12921.0,UNITED KINGDOM,0
C494448,75049L,Large Circular Mirror Mobile,-12,2010-01-14 13:36:00,1.25,14667.0,UNITED KINGDOM,0
C494449,,Chick Grey Hot Water Bottle,-1,2010-01-14 13:49:00,3.45,13093.0,UNITED KINGDOM,0
C494452,,White Beaded Garland String 20Light,-1,2010-01-14 13:51:00,6.35,15684.0,UNITED KINGDOM,0
C494453,,Woodland Storage Box Small,-17,2010-01-14 13:55:00,0.85,15222.0,UNITED KINGDOM,0
C494457,90200E,Green Sweetheart Bracelet,-1,2010-01-14 14:12:00,4.25,14667.0,UNITED KINGDOM,0
C494457,75049L,Large Circular Mirror Mobile,-12,2010-01-14 14:12:00,1.25,14667.0,UNITED KINGDOM,0
,82545A,Cognac Aux Oeufs Metal 1 Hook,3,2010-01-14 14:18:00,1.25,14667.0,UNITED KINGDOM,0
C494466,,Green Christmas Tree String 20Light,-1,2010-01-14 14:25:00,4.95,17032.0,UNITED KINGDOM,0
C494472,GIFT_0001_80,Dotcomgiftshop Gift Voucher 80.00,-1,2010-01-14 14:51:00,69.56,,UNITED KINGDOM,1
C494474,,Easter Bunny Wreath,-4,2010-01-14 15:06:00,4.95,12471.0,GERMANY,0
C494477,M,Manual,-1,2010-01-14 15:40:00,1747.62,,UNITED KINGDOM,1
,84849D,Hot Baths Soap Holder,1,2010-01-14 16:16:00,1.69,15768.0,UNITED KINGDOM,0
C494486,35603B,S/16 Black Shiny/Mat Baubles,-24,2010-01-14 17:02:00,2.1,16858.0,UNITED KINGDOM,0
C494486,,Retro Spot Large Milk Jug,-2,2010-01-14 17:02:00,4.95,16858.0,UNITED KINGDOM,0
C494488,,Vintage Wooden Plate Rack,-1,2010-01-14 17:13:00,39.95,16875.0,UNITED KINGDOM,0
C494489,,Retro Spot Tea Set Ceramic 11 Pc,-1,2010-01-14 17:14:00,4.95,15810.0,UNITED KINGDOM,0
C494491,,Four Hook  White Lovebirds,-1,2010-01-14 17:20:00,2.1,17675.0,UNITED KINGDOM,0
C494491,85123A,White Hanging Heart T-Light Holder,-2,2010-01-14 17:20:00,2.55,17675.0,UNITED KINGDOM,0
C494492,,Top Secret Pen Set,-4,2010-01-14 17:21:00,1.25,12712.0,GERMANY,0
C494493,,Green Christmas Tree Card Holder,-1,2010-01-14 17:26:00,4.25,15326.0,UNITED KINGDOM,0
C494494,,Frying Pan Pink Polkadot,-1,2010-01-14 17:29:00,4.25,13338.0,UNITED KINGDOM,0
C494496,,Red Spot Heart Hot Water Bottle,-4,2010-01-14 17:56:00,4.95,13394.0,UNITED KINGDOM,0
C494497,,Large Cake Towel Pink Spots,-2,2010-01-14 17:59:00,5.95,13360.0,UNITED KINGDOM,0
C494497,84520D,Pack Of 20 Fairy Cake Paper Napkins,-1,2010-01-14 17:59:00,0.85,13360.0,UNITED KINGDOM,0
C494500,,Retro Spot Cake Stand,-1,2010-01-14 18:06:00,10.95,13711.0,UNITED KINGDOM,0
C494501,,Set Of 20 Kids Cookie Cutters,-12,2010-01-14 18:07:00,1.95,15358.0,UNITED KINGDOM,0
C494502,,Ceramic Cake Stand + Hanging Cakes,-1,2010-01-14 18:08:00,9.95,14290.0,UNITED KINGDOM,0
,16206B,,96,2010-01-15 10:58:00,0.0,,UNITED KINGDOM,1
C494592,,Flower Windmill,-1,2010-01-15 12:08:00,1.25,15898.0,UNITED KINGDOM,0
C494593,,Retro Coffee Mugs Assorted,-1,2010-01-15 12:11:00,1.25,15326.0,UNITED KINGDOM,0
C494604,,Vintage Heads And Tails Card Game,-12,2010-01-15 12:22:00,1.25,12613.0,GERMANY,0
C494629,,"Assorted Flower Colour ""Leis""",-72,2010-01-15 16:48:00,0.65,13983.0,UNITED KINGDOM,0
C494650,,White Beaded Garland String 20Light,-1,2010-01-17 12:29:00,6.35,17969.0,UNITED KINGDOM,0
C494650,15056P,Edwardian Parasol Pink,-1,2010-01-17 12:29:00,5.95,17969.0,UNITED KINGDOM,0
,72796C,S/3 Rose Garden Scent Squ Candle,1,2010-01-17 13:55:00,1.65,13831.0,UNITED KINGDOM,0
,85027L,French Chateau Large Platter,2,2010-01-17 14:53:00,7.95,13869.0,UNITED KINGDOM,0
C494712,,Pink Diamante Pen In Gift Box,-1,2010-01-18 12:20:00,4.95,17841.0,UNITED KINGDOM,0
,84972M,,-1,2010-01-18 12:25:00,0.0,,UNITED KINGDOM,1
,90189A,Silver 2 Strand Necklace-Leaf Charm,1,2010-01-18 13:24:00,7.64,,UNITED KINGDOM,1
C494791,,Round Snack Boxes Set Of4 Woodland,-3,2010-01-18 14:04:00,2.95,12649.0,GERMANY,0
C494793,,Two Door Curio Cabinet,-2,2010-01-18 14:10:00,12.75,13110.0,UNITED KINGDOM,0
,85023C,Pink Large Jeweled Photoframe,1,2010-01-18 14:23:00,2.55,18036.0,UNITED KINGDOM,0
C494801,,"Charlotte Bag , Suki Design",-1,2010-01-18 14:58:00,0.85,15005.0,UNITED KINGDOM,0
C494801,85025C,Pink Heart Shape Photo Frame,-1,2010-01-18 14:58:00,1.65,15005.0,UNITED KINGDOM,0
C494801,85023A,Crystal Large Jewelled Photo Frame,-1,2010-01-18 14:58:00,2.55,15005.0,UNITED KINGDOM,0
C494802,,Blue Diner Wall Clock,-1,2010-01-18 15:01:00,8.5,17231.0,UNITED KINGDOM,0
C494810,,Retro Spot Traditional Teapot,-1,2010-01-18 16:28:00,16.98,,UNITED KINGDOM,1
C494810,POST,Postage,-1,2010-01-18 16:28:00,4.45,,UNITED KINGDOM,1
,90036B,"Flower Glass Garland Neckl.36""Green",1,2010-01-18 16:47:00,7.95,14343.0,UNITED KINGDOM,0
,90059B,Diamante Hair Grip Pack/2 Black Dia,1,2010-01-19 09:05:00,1.69,,UNITED KINGDOM,1
,90183A,Amber Drop Earrings W Long Beads,1,2010-01-19 09:05:00,2.96,,UNITED KINGDOM,1
,62094B,Turq Ice Cream Bum Bag,1,2010-01-19 09:05:00,5.06,,UNITED KINGDOM,1
C494869,,Zinc Folkart Sleigh Bells,-1,2010-01-19 12:13:00,1.69,12468.0,GERMANY,0
C494869,47594B,Scotties Design Washbag,-2,2010-01-19 12:13:00,1.95,12468.0,GERMANY,0
,84966B,Blue Kashmiri Boxed Mirror,3,2010-01-19 12:18:00,20.0,14715.0,UNITED KINGDOM,0
,84966A,Pink Kashmiri Boxed Mirror,3,2010-01-19 12:18:00,20.0,14715.0,UNITED KINGDOM,0
C494877,,Red Spotty Cup,-48,2010-01-19 12:39:00,0.85,14113.0,UNITED KINGDOM,0
,84800L,Large White/Pink Rose Art Flower,3,2010-01-19 13:09:00,2.12,14472.0,UNITED KINGDOM,0
,84804A,Cream Delphinium Artificial Flower,1,2010-01-19 13:09:00,2.95,14472.0,UNITED KINGDOM,0
C494907,,Garden Path Journal,-144,2010-01-19 16:36:00,2.1,17307.0,UNITED KINGDOM,0
C494909,D,Discount,-30,2010-01-19 16:45:00,0.4,12931.0,UNITED KINGDOM,0
,PADS,Pads To Match All Cushions,1,2010-01-19 17:04:00,0.001,16705.0,UNITED KINGDOM,0
,16161G,Wrap Bad Hair Day,25,2010-01-19 17:12:00,0.1,13564.0,UNITED KINGDOM,0
,85024B,Eau De Nile Jewelled Photoframe,1,2010-01-19 17:32:00,1.65,14983.0,UNITED KINGDOM,0
,90141D,Rose Pendant Triple Shell Necklace,1,2010-01-19 17:49:00,5.51,,UNITED KINGDOM,1
C494926,,Frog King Watering Can,-6,2010-01-20 10:25:00,2.95,15298.0,UNITED KINGDOM,0
C494927,,6 Egg House Painted Wood,-10,2010-01-20 10:28:00,7.95,15100.0,UNITED KINGDOM,0
C494928,,Retro Spot Tea Set Ceramic 11 Pc,-1,2010-01-20 10:30:00,4.95,13622.0,UNITED KINGDOM,0
C494929,,Ma Campagne Cutlery Box,-1,2010-01-20 10:37:00,14.95,14256.0,UNITED KINGDOM,0
C494949,,Hanging Jam Jar T-Light Holder,-4,2010-01-20 10:48:00,0.85,14225.0,UNITED KINGDOM,0
C494954,,Home Sweet Home  Blackboard,-3,2010-01-20 10:49:00,6.35,17469.0,UNITED KINGDOM,0
C494957,85185E,Duck Sock Puppet,-2,2010-01-20 10:53:00,2.55,14952.0,UNITED KINGDOM,0
C494973,,Lunch Bag Woodland,-50,2010-01-20 11:06:00,1.45,14156.0,EIRE,0
C494984,D,Discount,-1,2010-01-20 11:12:00,70.0,17949.0,UNITED KINGDOM,0
C494985,,Glass Cake Stand Mirrored Base,-1,2010-01-20 11:29:00,14.95,13965.0,UNITED KINGDOM,0
C494986,,String Of 20 Rose Lights,-1,2010-01-20 11:31:00,10.95,13093.0,UNITED KINGDOM,0
C494988,,Assorted Colour Silk Cosmetic Purse,-1,2010-01-20 11:36:00,2.1,15823.0,UNITED KINGDOM,0
C494992,,Ladle Love Heart Red,-12,2010-01-20 12:04:00,0.42,14290.0,UNITED KINGDOM,0
C494992,M,Manual,-10,2010-01-20 12:04:00,1.25,14290.0,UNITED KINGDOM,0
C495012,,Cake Stand Lace White,-24,2010-01-20 13:03:00,3.75,15311.0,UNITED KINGDOM,0
C495012,75049L,Large Circular Mirror Mobile,-96,2010-01-20 13:03:00,0.85,15311.0,UNITED KINGDOM,0
C495012,84997C,Blue 3 Piece Mini Dots Cutlery Set,-72,2010-01-20 13:03:00,3.39,15311.0,UNITED KINGDOM,0
C495012,16256C,Hearts Pencil/Rubber+5 Mini Pencils,-14,2010-01-20 13:03:00,0.42,15311.0,UNITED KINGDOM,0
C495014,,Ceramic Cake Stand + Hanging Cakes,-1,2010-01-20 13:08:00,9.95,15312.0,UNITED KINGDOM,0
C495015,,Frying Pan Pink Polkadot,-1,2010-01-20 13:08:00,3.75,13093.0,UNITED KINGDOM,0
C495017,,Ceramic Cake Design Spotted Plate,-3,2010-01-20 13:14:00,1.49,14861.0,UNITED KINGDOM,0
C495018,72803B,Ocean Scent Candle Jewelled Drawer,-1,2010-01-20 13:15:00,4.25,16933.0,UNITED KINGDOM,0
C495018,84876C,Silver Heart Compact Mirror,-1,2010-01-20 13:15:00,3.75,16933.0,UNITED KINGDOM,0
C495018,72807C,Set/3 Vanilla Scented Candle In Box,-1,2010-01-20 13:15:00,4.25,16933.0,UNITED KINGDOM,0
C495019,,Skulls Storage Box Large,-6,2010-01-20 13:16:00,2.95,13152.0,UNITED KINGDOM,0
C495019,85183B,Charlie & Lola Wastepaper Bin Flora,-1,2010-01-20 13:16:00,3.75,13152.0,UNITED KINGDOM,0
C495021,,Home Sweet Home Mug,-3,2010-01-20 13:25:00,1.25,13050.0,UNITED KINGDOM,0
C495023,,Red Spotty Childs Umbrella,-2,2010-01-20 13:29:00,3.25,16843.0,UNITED KINGDOM,0
C495024,,Coffee Mug Pears  Design,-3,2010-01-20 13:35:00,2.55,17679.0,UNITED KINGDOM,0
C495025,,Pack Of 60 Pink Paisley Cake Cases,-24,2010-01-20 13:43:00,0.55,12921.0,UNITED KINGDOM,0
C495026,,Cake Stand 3 Tier Magic Garden,-1,2010-01-20 13:46:00,12.75,15607.0,UNITED KINGDOM,0
C495032,,Red Spotty Charlotte Bag,-1,2010-01-20 14:05:00,0.85,13982.0,UNITED KINGDOM,0
C495034,,Red Hanging Heart T-Light Holder,-3,2010-01-20 14:14:00,2.95,16556.0,UNITED KINGDOM,0
C495035,,Retro Spot Traditional Teapot,-2,2010-01-20 14:16:00,7.95,15358.0,UNITED KINGDOM,0
C495036,,Retro Spot Cake Stand,-1,2010-01-20 14:18:00,10.95,13319.0,UNITED KINGDOM,0
C495036,79191C,Retro Plastic Elephant Tray,-1,2010-01-20 14:18:00,0.85,13319.0,UNITED KINGDOM,0
C495037,,Retro Spot Cake Stand,-1,2010-01-20 14:21:00,10.95,16143.0,UNITED KINGDOM,0
C495040,,Strawberry Ceramic Trinket Box,-4,2010-01-20 14:22:00,1.25,16204.0,UNITED KINGDOM,0
C495043,,Ceramic Cake Design Spotted Plate,-1,2010-01-20 14:24:00,1.49,13287.0,UNITED KINGDOM,0
C495054,M,Manual,-1,2010-01-20 14:43:00,756.85,14911.0,EIRE,0
C495060,,Pink Paisley Square Tissue Box,-12,2010-01-20 16:20:00,1.25,15489.0,UNITED KINGDOM,0
C495065,,Strawberry Ceramic Trinket Box,-5,2010-01-20 16:47:00,1.25,15224.0,UNITED KINGDOM,0
,90019B,Gold M.O.P Orbit Bracelet,1,2010-01-20 17:50:00,5.51,,UNITED KINGDOM,1
C495076,,Christmas Pudding Trinket Pot,-1,2010-01-21 09:19:00,1.45,16150.0,UNITED KINGDOM,0
C495076,85123A,White Hanging Heart T-Light Holder,-4,2010-01-21 09:19:00,2.95,16150.0,UNITED KINGDOM,0
C495084,85136C,Red Shark Helicopter,-1,2010-01-21 10:17:00,8.47,,UNITED KINGDOM,1
C495088,84967B,Blue Kashmiri Occasional Table,-1,2010-01-21 10:46:00,79.95,17675.0,UNITED KINGDOM,0
C495101,,Ceramic Cake Design Spotted Plate,-1,2010-01-21 11:06:00,1.49,14714.0,UNITED KINGDOM,0
C495103,,Retro Spot Cake Stand,-1,2010-01-21 11:21:00,10.95,15547.0,UNITED KINGDOM,0
C495147,,Set/3 Tall Glass Candle Holder Pink,-4,2010-01-21 11:40:00,3.95,17172.0,UNITED KINGDOM,0
C495155,,Polkadot Cutlery 24 Pcs In Tray,-1,2010-01-21 12:33:00,12.75,13623.0,UNITED KINGDOM,0
C495155,79065A,Teatime Round Cake Tins,-1,2010-01-21 12:33:00,9.95,13623.0,UNITED KINGDOM,0
C495170,,Ceramic Birdhouse Red Roof Small,-1,2010-01-21 12:45:00,2.95,13148.0,UNITED KINGDOM,0
C495170,85166A,White Metal Baroque Photo Frame,-1,2010-01-21 12:45:00,3.75,13148.0,UNITED KINGDOM,0
C495172,,Silver Lattice Vanilla Candle Pot,-4,2010-01-21 12:51:00,3.75,15885.0,UNITED KINGDOM,0
C495172,72803A,Rose Scent Candle Jewelled Drawer,-1,2010-01-21 12:51:00,4.25,15885.0,UNITED KINGDOM,0
C495173,85099C,Jumbo  Bag Baroque Black White,-1,2010-01-21 12:55:00,1.95,15805.0,UNITED KINGDOM,0
C495173,79323GR,Green Cherry Lights,-2,2010-01-21 12:55:00,6.75,15805.0,UNITED KINGDOM,0
C495173,79323G,Gold  Cherry Lights,-1,2010-01-21 12:55:00,6.75,15805.0,UNITED KINGDOM,0
C495174,72753D,S/3 Flwr Fairy Summer Candles,-8,2010-01-21 12:59:00,2.1,13901.0,UNITED KINGDOM,0
C495175,,Dairy Maid  Small  Milk Jug,-1,2010-01-21 13:15:00,2.1,14527.0,UNITED KINGDOM,0
C495175,85123A,White Hanging Heart T-Light Holder,-1,2010-01-21 13:15:00,2.95,14527.0,UNITED KINGDOM,0
,17014F,Origami Sandlewood Incense Cones,1,2010-01-21 13:33:00,1.65,13735.0,UNITED KINGDOM,0
C495181,,Victorian Sewing Box Large,-1,2010-01-21 13:45:00,12.75,14421.0,UNITED KINGDOM,0
C495186,,Antique Lily Fairy Lights,-1,2010-01-21 14:30:00,4.25,15311.0,UNITED KINGDOM,0
C495190,,Victorian Sewing Box Medium,-1,2010-01-21 14:47:00,7.95,14606.0,UNITED KINGDOM,0
C495190,37494A,Fairy Cake Ceramic Butter Dish,-1,2010-01-21 14:47:00,2.95,14606.0,UNITED KINGDOM,0
,84933D,,-4,2010-01-21 14:51:00,0.0,,UNITED KINGDOM,1
,16200A,,-3,2010-01-21 16:39:00,0.0,,UNITED KINGDOM,1
,35813A,,-12,2010-01-21 17:27:00,0.0,,UNITED KINGDOM,1
,37445A,,-1,2010-01-21 17:31:00,0.0,,UNITED KINGDOM,1
,37445C,,-16,2010-01-21 17:31:00,0.0,,UNITED KINGDOM,1
,37365Y,,-148,2010-01-21 17:31:00,0.0,,UNITED KINGDOM,1
,37445D,,-10,2010-01-21 17:32:00,0.0,,UNITED KINGDOM,1
C495231,M,Manual,-1,2010-01-22 09:13:00,756.85,14911.0,EIRE,0
C495234,M,Manual,-1,2010-01-22 09:39:00,1193.89,14156.0,EIRE,0
C495281,,Flamingo Lights,-1,2010-01-22 12:27:00,4.95,16229.0,UNITED KINGDOM,0
,37493C,,-36,2010-01-22 13:35:00,0.0,,UNITED KINGDOM,1
,37493B,,-37,2010-01-22 13:36:00,0.0,,UNITED KINGDOM,1
,37493D,,-44,2010-01-22 13:36:00,0.0,,UNITED KINGDOM,1
,84874A,,-1,2010-01-22 13:38:00,0.0,,UNITED KINGDOM,1
,84898E,,-7,2010-01-22 13:39:00,0.0,,UNITED KINGDOM,1
,79023B,,-57,2010-01-22 14:06:00,0.0,,UNITED KINGDOM,1
C495309,,Teatime Cake Tin With Handle,-1,2010-01-22 14:16:00,9.95,17243.0,UNITED KINGDOM,0
,85032B,Blossom Images Gift Wrap Set,6,2010-01-22 14:17:00,2.1,12531.0,GERMANY,0
C495319,35980C,Redwhite Stripe Scandinavian Heart,-44,2010-01-22 15:09:00,0.38,17888.0,UNITED KINGDOM,0
C495319,,Rex Cash+Carry Jumbo Shopper,-1,2010-01-22 15:09:00,0.95,17888.0,UNITED KINGDOM,0
,44266F,,-2,2010-01-22 15:54:00,0.0,,UNITED KINGDOM,1
,47581A,,-16,2010-01-22 15:55:00,0.0,,UNITED KINGDOM,1
,79065B,,-2,2010-01-22 15:59:00,0.0,,UNITED KINGDOM,1
,84494B,,18,2010-01-22 16:01:00,0.0,,UNITED KINGDOM,1
,84575A,,-14,2010-01-22 17:10:00,0.0,,UNITED KINGDOM,1
,84555A,,-19,2010-01-22 17:14:00,0.0,,UNITED KINGDOM,1
C495341,,Washroom Metal Sign,-4,2010-01-22 17:32:00,1.25,14031.0,UNITED KINGDOM,0
,15058A,Blue White Spots Garden Parasol,2,2010-01-24 12:12:00,7.95,15727.0,UNITED KINGDOM,0
,15058C,Ice Cream Design Garden Parasol,2,2010-01-24 12:12:00,7.95,15727.0,UNITED KINGDOM,0
,90128A,Pink Leaves And Beads Phone Charm,1,2010-01-24 12:15:00,1.25,14701.0,UNITED KINGDOM,0
,90162D,Ant Silver Purple Boudicca Ring,2,2010-01-24 12:15:00,2.95,14701.0,UNITED KINGDOM,0
,90162A,Ant Silver Turquoise Boudicca Ring,1,2010-01-24 12:15:00,2.95,14701.0,UNITED KINGDOM,0
,90128B,Blue Leaves And Beads Phone Charm,1,2010-01-24 12:15:00,1.25,14701.0,UNITED KINGDOM,0
C495368,,Vintage Union Jack Memoboard,-1,2010-01-24 12:28:00,9.95,13527.0,UNITED KINGDOM,0
C495373,,Black And White Paisley Flower Mug,-6,2010-01-24 13:00:00,1.25,12748.0,UNITED KINGDOM,0
,84806A,Pink Candystuft Artificial Flower,2,2010-01-24 15:54:00,1.45,14986.0,UNITED KINGDOM,0
,72751D,,-20,2010-01-25 11:08:00,0.0,,UNITED KINGDOM,1
,72697A,,-32,2010-01-25 11:15:00,0.0,,UNITED KINGDOM,1
,72024HC,,-3669,2010-01-25 12:07:00,0.0,,UNITED KINGDOM,1
C495468,,Heart Shape Wireless Doorbell,-1,2010-01-25 12:10:00,2.1,16795.0,UNITED KINGDOM,0
C495502,,Retro Spots Butter Dish,-1,2010-01-25 12:35:00,4.95,12644.0,GERMANY,0
C495502,47367B,Pair Padded Hangers Pink Check,-1,2010-01-25 12:35:00,3.75,12644.0,GERMANY,0
,35638A,Pink And Black String Curtain,1,2010-01-25 14:01:00,5.95,17841.0,UNITED KINGDOM,0
C495511,,Pink Ear Muff Headphones,-1,2010-01-25 14:04:00,5.49,17841.0,UNITED KINGDOM,0
C495516,35004S,Set Of 3 Silver Flying Ducks,-1,2010-01-25 14:26:00,6.35,13564.0,UNITED KINGDOM,0
C495516,,Vintage Glass Sugar Caddy,-1,2010-01-25 14:26:00,5.95,13564.0,UNITED KINGDOM,0
C495516,72739C,Dark Chocolate Scentcandle,-13,2010-01-25 14:26:00,1.25,13564.0,UNITED KINGDOM,0
C495525,,5 Hook Blackboard Organiser,-1,2010-01-25 14:37:00,9.95,14606.0,UNITED KINGDOM,0
C495525,85135A,Yellow Dragonfly Helicopter,-1,2010-01-25 14:37:00,7.95,14606.0,UNITED KINGDOM,0
C495528,,Antique Lily Fairy Lights,-1,2010-01-25 15:00:00,4.95,17610.0,UNITED KINGDOM,0
,44241C,Blue Butterfly On Spring,4,2010-01-25 15:36:00,0.85,14376.0,UNITED KINGDOM,0
,84030B,Knitted Pom Pom Hot Water Bottle,1,2010-01-25 15:38:00,8.46,,UNITED KINGDOM,1
,84867B,Blue Baby Boy'S Photo Album,2,2010-01-25 15:42:00,13.57,,UNITED KINGDOM,1
C495552,M,Manual,-144,2010-01-25 16:22:00,0.35,13206.0,UNITED KINGDOM,0
C495579,M,Manual,-1,2010-01-26 09:52:00,4.93,12600.0,GERMANY,0
C495582,79323P,Pink Cherry Lights,-1,2010-01-26 10:09:00,6.75,16719.0,UNITED KINGDOM,0
C495582,79323LP,Light Pink Cherry Lights,-1,2010-01-26 10:09:00,6.75,16719.0,UNITED KINGDOM,0
C495582,79323W,White Cherry Lights,-1,2010-01-26 10:09:00,6.75,16719.0,UNITED KINGDOM,0
,79303A,White Rohmbic Block Table Lamp,2,2010-01-26 10:13:00,2.95,16719.0,UNITED KINGDOM,0
C495585,,Rotating Silver Angels T-Light Hldr,-3,2010-01-26 10:17:00,1.25,18223.0,UNITED KINGDOM,0
C495585,79323W,White Cherry Lights,-2,2010-01-26 10:17:00,5.45,18223.0,UNITED KINGDOM,0
C495585,79323P,Pink Cherry Lights,-2,2010-01-26 10:17:00,5.45,18223.0,UNITED KINGDOM,0
C495585,85099F,Jumbo Bag Strawberry,-1,2010-01-26 10:17:00,1.95,18223.0,UNITED KINGDOM,0
C495586,,Chilli Lights,-2,2010-01-26 10:18:00,4.25,16353.0,UNITED KINGDOM,0
C495587,,Cream Sweetheart Wall Cabinet,-1,2010-01-26 10:19:00,18.95,15046.0,UNITED KINGDOM,0
C495632,75049L,Large Circular Mirror Mobile,-5,2010-01-26 10:47:00,0.85,15218.0,UNITED KINGDOM,0
C495632,,15Cm Christmas Glass Ball 20 Lights,-1,2010-01-26 10:47:00,6.95,15218.0,UNITED KINGDOM,0
C495635,,Willow Branch Lights.,-6,2010-01-26 10:54:00,6.75,15950.0,UNITED KINGDOM,0
C495679,,Camouflage Backpack On Wheels,-1,2010-01-26 11:38:00,8.5,17353.0,UNITED KINGDOM,0
C495685,,Retro Spots Butter Dish,-1,2010-01-26 12:04:00,4.95,14527.0,UNITED KINGDOM,0
C495685,85136B,Blue Shark Helicopter,-1,2010-01-26 12:04:00,7.95,14527.0,UNITED KINGDOM,0
C495697,,Retro Spots Butter Dish,-2,2010-01-26 12:29:00,4.95,14527.0,UNITED KINGDOM,0
C495705,,Party Cones Carnival Assorted,-36,2010-01-26 13:01:00,1.25,15518.0,UNITED KINGDOM,0
,84868A,Pink Baby Girl'S Memory Box,1,2010-01-26 13:04:00,6.95,15003.0,UNITED KINGDOM,0
,84868B,Blue Baby Boy'S Memory Box,1,2010-01-26 13:04:00,6.95,15003.0,UNITED KINGDOM,0
,71434B,"Black Rnd Bullet""Keep Clean"" Bin",1,2010-01-26 13:15:00,2.55,,UNITED KINGDOM,1
C495714,,Colour Glass. Star T-Light Holder,-12,2010-01-26 13:53:00,3.25,14194.0,UNITED KINGDOM,0
,46000R,Polyester Filler Pad 45X30Cm,2,2010-01-26 14:18:00,1.45,,UNITED KINGDOM,1
C495723,85167A,White Grand Baroque Photo Frame,-27,2010-01-26 14:56:00,3.0,14037.0,UNITED KINGDOM,0
,ADJUST,Adjustment By John On 26/01/2010 16,1,2010-01-26 16:20:00,96.46,,EIRE,1
C495737,ADJUST,Adjustment By John On 26/01/2010 16,-1,2010-01-26 16:23:00,10.5,16154.0,UNITED KINGDOM,0
C495740,ADJUST,Adjustment By John On 26/01/2010 16,-1,2010-01-26 16:24:00,14.0,13054.0,UNITED KINGDOM,0
C495738,ADJUST,Adjustment By John On 26/01/2010 16,-1,2010-01-26 16:24:00,26.25,12454.0,SPAIN,0
C495739,ADJUST,Adjustment By John On 26/01/2010 16,-1,2010-01-26 16:24:00,10.5,15383.0,UNITED KINGDOM,0
C495744,ADJUST,Adjustment By John On 26/01/2010 16,-1,2010-01-26 16:25:00,91.89,12706.0,FINLAND,0
C495741,ADJUST,Adjustment By John On 26/01/2010 16,-1,2010-01-26 16:25:00,13.14,16840.0,UNITED KINGDOM,0
C495743,ADJUST,Adjustment By John On 26/01/2010 16,-1,2010-01-26 16:25:00,18.38,12382.0,NETHERLANDS,0
,48173A,Door Mat Blue Flock,1,2010-01-26 16:26:00,6.75,15959.0,UNITED KINGDOM,0
C495751,ADJUST,Adjustment By John On 26/01/2010 16,-1,2010-01-26 16:28:00,26.19,12858.0,UNITED KINGDOM,0
C495757,ADJUST,Adjustment By John On 26/01/2010 16,-1,2010-01-26 16:30:00,10.49,16575.0,UNITED KINGDOM,0
C495759,ADJUST,Adjustment By John On 26/01/2010 16,-1,2010-01-26 16:31:00,15.75,12647.0,GERMANY,0
C495761,ADJUST,Adjustment By John On 26/01/2010 16,-1,2010-01-26 16:31:00,13.14,13664.0,UNITED KINGDOM,0
C495762,ADJUST,Adjustment By John On 26/01/2010 16,-1,2010-01-26 16:32:00,125.78,14285.0,UNITED KINGDOM,0
C495764,ADJUST,Adjustment By John On 26/01/2010 16,-1,2010-01-26 16:35:00,13.13,12792.0,PORTUGAL,0
C495767,ADJUST,Adjustment By John On 26/01/2010 16,-1,2010-01-26 16:39:00,50.76,12696.0,FINLAND,0
C495769,ADJUST,Adjustment By John On 26/01/2010 16,-1,2010-01-26 16:47:00,18.38,17130.0,UNITED KINGDOM,0
C495770,ADJUST,Adjustment By John On 26/01/2010 16,-1,2010-01-26 16:49:00,36.75,15357.0,UNSPECIFIED,0
C495771,ADJUST,Adjustment By John On 26/01/2010 16,-1,2010-01-26 16:51:00,13.12,13776.0,UNITED KINGDOM,0
C495772,ADJUST,Adjustment By John On 26/01/2010 16,-1,2010-01-26 16:55:00,22.95,12600.0,GERMANY,0
C495775,M,Manual,-16,2010-01-26 16:59:00,2.5,13528.0,UNITED KINGDOM,0
C495778,ADJUST,Adjustment By John On 26/01/2010 17,-1,2010-01-26 17:07:00,10.51,15266.0,UNITED KINGDOM,0
C495779,ADJUST,Adjustment By John On 26/01/2010 17,-1,2010-01-26 17:08:00,15.74,16168.0,UNITED KINGDOM,0
